"LEK8CS3X","forumPost","2022","Texas DPS [@TxDPS]","Our mission under Gov. @GregAbbott_TX's #OperationLoneStar never stops. Our work to secure the border continues, day and night, w/Troopers working on the ground, while our aircraft and marine units take to the skies and waterways. Our goal is to protect and serve our state. https://t.co/kVOWjGEoSg","Twitter","","","","https://twitter.com/TxDPS/status/1488940333220171779","","2022-02-02","2022-04-03 12:33:29","2022-04-03 12:33:29","2022-04-03 12:33:29","","","","","","","","","","","","","","en","","Tweet","","","","","","","","https://t.co/kVOWjGEoSg","","","","","","","","","","","","","","","","","","","","","","","","","","","","","","","","","","","","","","","","","","","","","","","",""
"NUIXFBAU","forumPost","2022","Texas DPS [@TxDPS]","Texas has stepped up to help secure the border under Gov. @GregAbbott_TX's #OperationLoneStar to help prevent lethal drugs from entering Texas communities. #ProtectandServe https://t.co/NXrazB4GIb","Twitter","","","","https://twitter.com/TxDPS/status/1482054134798954500","","2022-01-14","2022-04-03 14:01:32","2022-04-03 14:01:32","2022-04-03 14:01:32","","","","","","","","","","","","","","en","","Tweet","","","","","","","","https://t.co/NXrazB4GIb","","","","","","","","","","","","","","","","","","","","","","","","","","","","","","","","","","","","","","","","","","","","","","","",""
"I3TAVGFK","forumPost","2022","Texas DPS [@TxDPS]","In the air or on the ground, DPS is working around-the-clock to secure our border as part of Gov. @GregAbbott_TX's #OperationLoneStar. https://t.co/XWRjQlsEuo","Twitter","","","","https://twitter.com/TxDPS/status/1481381331963682816","","2022-01-12","2022-04-03 14:01:51","2022-04-03 14:01:51","2022-04-03 14:01:51","","","","","","","","","","","","","","en","","Tweet","","","","","","","","https://t.co/XWRjQlsEuo","","","","","","","","","","","","","","","","","","","","","","","","","","","","","","","","","","","","","","","","","","","","","","","",""
"ZCBBQ8HK","forumPost","2022","Texas DPS [@TxDPS]","DPS is working day-and-night alongside our partners at @TXMilitary to secure the border under Gov. @GregAbbott_TX's Operation Lone Star. We are doing so through operations that combat smugglers, drug traffickers and other illegal activity. #BorderSecurity #OperationLoneStar https://t.co/hD70Z8a9Md","Twitter","","","","https://twitter.com/TxDPS/status/1479197662012485637","","2022-01-06","2022-04-03 14:02:06","2022-04-03 14:02:06","2022-04-03 14:02:06","","","","","","","","","","","","","","en","","Tweet","","","","","","","","https://t.co/hD70Z8a9Md","","","","","","","","","","","","","","","","","","","","","","","","","","","","","","","","","","","","","","","","","","","","","","","",""
"QK9VEN3D","forumPost","2022","Texas DPS [@TxDPS]","Every day, DPS works to stop illegal activity along the border, incl. combating the smuggling of deadly drugs into our state and curtailing human trafficking. DPS will continue to serve the people of Texas under Gov. @GregAbbott_TX's #OperationLoneStar to help secure the border. https://t.co/UyZiJxEjDW","Twitter","","","","https://twitter.com/TxDPS/status/1478826134913654791","","2022-01-05","2022-04-03 14:02:31","2022-04-03 14:02:31","2022-04-03 14:02:31","","","","","","","","","","","","","","en","","Tweet","","","","","","","","https://t.co/UyZiJxEjDW","","","","","","","","","","","","","","","","","","","","","","","","","","","","","","","","","","","","","","","","","","","","","","","",""
"S6A7ZPUN","forumPost","2021","Texas DPS [@TxDPS]","Thank you for your leadership, Gov. @GregAbbott_TX! #OperationLoneStar","Twitter","","","","https://twitter.com/TxDPS/status/1476621105326559232","","2021-12-30","2022-04-03 14:03:02","2022-04-03 14:03:02","2022-04-03 14:03:02","","","","","","","","","","","","","","en","","Tweet","","","","","","","","","","","","","","","","","","","","","","","","","","","","","","","","","","","","","","","","","","","","","","","","","","","","","","","",""
"HR3S53M4","forumPost","2021","Texas DPS [@TxDPS]","Texas has stepped up to secure our border & help prevent illegal drugs/criminal traffickers from entering TX under Gov. @GregAbbott_TX's #OperationLoneStar. One key component to this mission is DPS' Aircraft Operations; they provide eyes in skies for our Troopers on the ground. https://t.co/SIpWUjDnLe","Twitter","","","","https://twitter.com/TxDPS/status/1475921881731588096","","2021-12-28","2022-04-03 14:03:19","2022-04-03 14:03:19","2022-04-03 14:03:19","","","","","","","","","","","","","","en","","Tweet","","","","","","","","https://t.co/SIpWUjDnLe","","","","","","","","","","","","","","","","","","","","","","","","","","","","","","","","","","","","","","","","","","","","","","","",""
"VJB75YSZ","forumPost","2021","Texas DPS [@TxDPS]","DPS will continue to answer Gov. Abbott's call to secure the border and protect Texas under #OperationLoneStar.","Twitter","","","","https://twitter.com/TxDPS/status/1473392720874020878","","2021-12-21","2022-04-03 14:03:34","2022-04-03 14:03:34","2022-04-03 14:03:34","","","","","","","","","","","","","","en","","Tweet","","","","","","","","","","","","","","","","","","","","","","","","","","","","","","","","","","","","","","","","","","","","","","","","","","","","","","","",""
"6KCNHGRD","forumPost","2021","Texas DPS [@TxDPS]","Our work under Gov. @GregAbbott_TX's #OperationLoneStar is a collaborative effort among our assets — air, ground, marine and tactical security — to combat the smuggling of people and drugs into Texas. Our work is driven by the goal of protecting our fellow Texans. https://t.co/7zeDkgvCGB","Twitter","","","","https://twitter.com/TxDPS/status/1473042706498830342","","2021-12-20","2022-04-03 14:03:51","2022-04-03 14:03:51","2022-04-03 14:03:51","","","","","","","","","","","","","","en","","Tweet","","","","","","","","https://t.co/7zeDkgvCGB","","","","","","","","","","","","","","","","","","","","","","","","","","","","","","","","","","","","","","","","","","","","","","","",""
"MZKH5UBN","forumPost","2021","Texas DPS [@TxDPS]","Since #OperationLoneStar began in March, Gov. @GregAbbott_TX has supported our Troopers as they have worked hard to protect and serve our state along the border. Every day, our Troopers are working to interdict criminals and combat illegal activity at the #Border. https://t.co/oLAF0xs07x","Twitter","","","","https://twitter.com/TxDPS/status/1471933070131535882","","2021-12-17","2022-04-03 14:04:04","2022-04-03 14:04:04","2022-04-03 14:04:04","","","","","","","","","","","","","","en","","Tweet","","","","","","","","https://t.co/oLAF0xs07x","","","","","","","","","","","","","","","","","","","","","","","","","","","","","","","","","","","","","","","","","","","","","","","",""
"DYIH2BNH","forumPost","2021","Texas DPS [@TxDPS]","ICYMI: TMD, DPS Discuss Fence Construction at Weekly OLS Media Briefing https://dps.texas.gov/news/tmd-dps-discuss-fence-construction-weekly-ols-media-briefing #OperationLoneStar Gov. @GregAbbott_TX @TXMilitary https://t.co/fvo5GJtaXz","Twitter","","","","https://twitter.com/TxDPS/status/1471601769767649281","","2021-12-16","2022-04-03 14:04:17","2022-04-03 14:04:17","2022-04-03 14:04:17","","","","","","","","","","","","","","en","","Tweet","","","","","","","; ","https://dps.texas.gov/news/tmd-dps-discuss-fence-construction-weekly-ols-media-briefing; https://t.co/fvo5GJtaXz","","","","","","","","","","","","","","","","","","","","","","","","","","","","","","","","","","","","","","","","","","","","","","","",""
"IFCKZ5WM","forumPost","2021","Texas DPS [@TxDPS]","WATCH LIVE: Weekly #OperationLoneStar Briefing with DPS, Texas Military Department https://fb.watch/9X9kwlYcLB/","Twitter","","","","https://twitter.com/TxDPS/status/1471520345966448641","","2021-12-16","2022-04-03 14:04:31","2022-04-03 14:04:31","2022-04-03 14:04:31","","","","","","","","","","","","","","en","","Tweet","","","","","","","","https://fb.watch/9X9kwlYcLB/","","","","","","","","","","","","","","","","","","","","","","","","","","","","","","","","","","","","","","","","","","","","","","","",""
"HETS4U4Z","forumPost","2021","Texas DPS [@TxDPS]","Protecting & serving our state & the people who call it home will always be our No. 1 priority. That's what we are doing every day as part of our mission under Gov. @GregAbbott_TX's #OperationLoneStar. Day or night, DPS will always answer the call to keep our fellow Texans safe. https://t.co/DOT18sCwac","Twitter","","","","https://twitter.com/TxDPS/status/1471166207353053184","","2021-12-15","2022-04-03 14:04:45","2022-04-03 14:04:45","2022-04-03 14:04:45","","","","","","","","","","","","","","en","","Tweet","","","","","","","","https://t.co/DOT18sCwac","","","","","","","","","","","","","","","","","","","","","","","","","","","","","","","","","","","","","","","","","","","","","","","",""
"9KS7T23I","forumPost","2021","Texas DPS [@TxDPS]","Elite DPS Team Guards Against Illegal Immigrants Trespassing on Private Property as Part of #OperationLoneStar Featured on @FoxNews https://t.co/FmMobwfKtq","Twitter","","","","https://twitter.com/TxDPS/status/1470798635311013894","","2021-12-14","2022-04-03 14:04:56","2022-04-03 14:04:56","2022-04-03 14:04:56","","","","","","","","","","","","","","en","","Tweet","","","","","","","","https://t.co/FmMobwfKtq","","","","","","","","","","","","","","","","","","","","","","","","","","","","","","","","","","","","","","","","","","","","","","","",""
"ZFVXK3SI","forumPost","2021","Texas DPS [@TxDPS]","As part of Gov. @GregAbbott_TX's #OperationLoneStar, DPS Troopers are working around-the-clock to crack down on human smugglers and arrest those involved in illegal activity. Together with our partners, DPS is working hard to secure the border. https://t.co/Wb86JnQ29Z","Twitter","","","","https://twitter.com/TxDPS/status/1470506779117338628","","2021-12-13","2022-04-03 14:05:11","2022-04-03 14:05:11","2022-04-03 14:05:11","","","","","","","","","","","","","","en","","Tweet","","","","","","","","https://t.co/Wb86JnQ29Z","","","","","","","","","","","","","","","","","","","","","","","","","","","","","","","","","","","","","","","","","","","","","","","",""
"NFNJA3WR","forumPost","2021","Texas DPS [@TxDPS]","ICYMI: DPS Discusses Impacts of Fentanyl in U.S. at Weekly OLS Media Briefing https://dps.texas.gov/news/dps-discusses-impacts-fentanyl-us-weekly-ols-media-briefing #OperationLoneStar Gov. @GregAbbott_TX @TXMilitary https://t.co/FoDM9MrD7l","Twitter","","","","https://twitter.com/TxDPS/status/1469094510491844608","","2021-12-10","2022-04-03 14:05:24","2022-04-03 14:05:24","2022-04-03 14:05:24","","","","","","","","","","","","","","en","","Tweet","","","","","","","; ","https://dps.texas.gov/news/dps-discusses-impacts-fentanyl-us-weekly-ols-media-briefing; https://t.co/FoDM9MrD7l","","","","","","","","","","","","","","","","","","","","","","","","","","","","","","","","","","","","","","","","","","","","","","","",""
"2EXSVMB6","forumPost","2021","Texas DPS [@TxDPS]","We are thankful for Gov. @GregAbbott_TX's leadership on #OperationLoneStar. DPS & our partner agencies are able to fulfill the mission b/c of the support of state leadership. It's about working together to protect TX & stop criminals from smuggling humans & illegal drugs into TX. https://t.co/HqedJAPCff","Twitter","","","","https://twitter.com/TxDPS/status/1469059371854348288","","2021-12-09","2022-04-03 14:05:47","2022-04-03 14:05:47","2022-04-03 14:05:47","","","","","","","","","","","","","","en","","Tweet","","","","","","","","https://t.co/HqedJAPCff","","","","","","","","","","","","","","","","","","","","","","","","","","","","","","","","","","","","","","","","","","","","","","","",""
"8PTBRGGX","forumPost","2021","Texas DPS [@TxDPS]","Catch the livestream of today's #OperationLoneStar Briefing on DPS' Facebook page at https://bit.ly/3EH8DI0. During today's briefing, DPS and @TXMilitary provided an update on Gov. @GregAbbott_TX's #OperationLoneStar. DPS also focused on the influx of fentanyl.","Twitter","","","","https://twitter.com/TxDPS/status/1468984614899302403","","2021-12-09","2022-04-03 14:05:59","2022-04-03 14:05:59","2022-04-03 14:05:59","","","","","","","","","","","","","","en","","Tweet","","","","","","","","https://bit.ly/3EH8DI0","","","","","","","","","","","","","","","","","","","","","","","","","","","","","","","","","","","","","","","","","","","","","","","",""
"B9ELQM7Z","forumPost","2021","Texas DPS [@TxDPS]","Media Advisory: @LtChrisOlivarez and a DPS Seized Drugs System Specialist will discuss how much fentanyl has been seized during #OperationLoneStar and why it is so deadly. https://t.co/pdW14zzEgr","Twitter","","","","https://twitter.com/TxDPS/status/1468674883173425156","","2021-12-08","2022-04-03 14:06:12","2022-04-03 14:06:12","2022-04-03 14:06:12","","","","","","","","","","","","","","en","","Tweet","","","","","","","","https://t.co/pdW14zzEgr","","","","","","","","","","","","","","","","","","","","","","","","","","","","","","","","","","","","","","","","","","","","","","","",""
"VGB7A5I7","forumPost","2021","Texas DPS [@TxDPS]","DPS continues our increased presence along the border as part of Gov. @GregAbbott_TX's #OperationLoneStar. The department continues our work every day to deter and stop illegal activity from coming into Texas through the border. #ProtectandServe https://t.co/Q3ZnHm1mtZ","Twitter","","","","https://twitter.com/TxDPS/status/1467959028089335829","","2021-12-06","2022-04-03 14:06:23","2022-04-03 14:06:23","2022-04-03 14:06:23","","","","","","","","","","","","","","en","","Tweet","","","","","","","","https://t.co/Q3ZnHm1mtZ","","","","","","","","","","","","","","","","","","","","","","","","","","","","","","","","","","","","","","","","","","","","","","","",""
"ZNLNCZ4X","forumPost","2021","Texas DPS [@TxDPS]","Exclusive: @TxDPS bust human smuggling operation at border and ⁦@LtChrisOlivarez⁩ gives ⁦@BillFOXLA a birds eye view of Gov. ⁦@GregAbbott_TX⁩’s #OperationLoneStar in action | ⁦@FoxNews⁩ 👀👇🏽 https://t.co/XcVo3bAvrj","Twitter","","","","https://twitter.com/TxDPS/status/1467908986640945160","","2021-12-06","2022-04-03 14:06:35","2022-04-03 14:06:35","2022-04-03 14:06:35","","","","","","","","","","","","","","en","","Tweet","","","","","","","","https://t.co/XcVo3bAvrj","","","","","","","","","","","","","","","","","","","","","","","","","","","","","","","","","","","","","","","","","","","","","","","",""
"KN9PPVCY","forumPost","2021","Texas DPS [@TxDPS]","Today we enhanced operations in La Joya to stop the flow of migrants entering TX illegally. @TexasGameWarden, @TXMilitary and DPS’ Tactical Marine Unit will have a heavy presence on the river to apprehend smugglers and deter criminal activity. #OperationLoneStar https://t.co/EytIn5c196","Twitter","","","","https://twitter.com/TxDPS/status/1467610159476318220","","2021-12-05","2022-04-03 14:06:50","2022-04-03 14:06:50","2022-04-03 14:06:50","","","","","","","","","","","","","","en","","Tweet","","","","","","","","https://t.co/EytIn5c196","","","","","","","","","","","","","","","","","","","","","","","","","","","","","","","","","","","","","","","","","","","","","","","",""
"J4T5SIQZ","forumPost","2021","Texas DPS [@TxDPS]","Our work to secure the border continues through Gov. @GregAbbott_TX's #OperationLoneStar and brings together the resources to combat the smuggling of people and drugs into Texas. https://t.co/16D6kIFlSL","Twitter","","","","https://twitter.com/TxDPS/status/1466847702692544519","","2021-12-03","2022-04-03 14:07:04","2022-04-03 14:07:04","2022-04-03 14:07:04","","","","","","","","","","","","","","en","","Tweet","","","","","","","","https://t.co/16D6kIFlSL","","","","","","","","","","","","","","","","","","","","","","","","","","","","","","","","","","","","","","","","","","","","","","","",""
"JN5FLW8X","forumPost","2021","Texas DPS [@TxDPS]","“Other smugglers have been caught by TX authorities attempting to move drugs into the U.S. from Mexico. Since March, TX officials have intercepted more than 13,000lbs. of marijuana, 2,400lbs. of cocaine, 1,000lbs. of methamphetamine, and 157lbs. of fentanyl.” #OperationLoneStar","Twitter","","","","https://twitter.com/TxDPS/status/1466832394460311557","","2021-12-03","2022-04-03 14:07:19","2022-04-03 14:07:19","2022-04-03 14:07:19","","","","","","","","","","","","","","en","","Tweet","","","","","","","","","","","","","","","","","","","","","","","","","","","","","","","","","","","","","","","","","","","","","","","","","","","","","","","",""
"RL2C942E","forumPost","2021","Texas DPS [@TxDPS]","""With an uptick in deadly drugs like fentanyl, dangerous gang activity, and human trafficking across our state, the State of Texas continues to work closely with local law enforcement to solve these challenges."" - Gov. @GregAbbott_TX #OperationLoneStar https://t.co/Wjg33fAXAx","Twitter","","","","https://twitter.com/TxDPS/status/1466494063255957511","","2021-12-02","2022-04-03 14:07:33","2022-04-03 14:07:33","2022-04-03 14:07:33","","","","","","","","","","","","","","en","","Tweet","","","","","","","","https://t.co/Wjg33fAXAx","","","","","","","","","","","","","","","","","","","","","","","","","","","","","","","","","","","","","","","","","","","","","","","",""
"4MHGY9DE","forumPost","2021","Texas DPS [@TxDPS]","“The morale for State Troopers is at an all-time high. We have tremendous support from Gov. ⁦@GregAbbott_TX⁩, from the #txlege, and from our state leadership.” -- ⁦@LtChrisOlivarez⁩ #OperationLoneStar https://t.co/UJRJDzR1KK","Twitter","","","","https://twitter.com/TxDPS/status/1465377604601536528","","2021-11-29","2022-04-03 14:07:48","2022-04-03 14:07:48","2022-04-03 14:07:48","","","","","","","","","","","","","","en","","Tweet","","","","","","","","https://t.co/UJRJDzR1KK","","","","","","","","","","","","","","","","","","","","","","","","","","","","","","","","","","","","","","","","","","","","","","","",""
"HEJE4X5S","forumPost","2021","Texas DPS [@TxDPS]","ICYMI: 💙 this Gov. @GregAbbott_TX Thanksgiving Border Visit Video 👀👇🏽 https://youtu.be/HI5wbYi4dHA #OperationLoneStar","Twitter","","","","https://twitter.com/TxDPS/status/1464237284446846991","","2021-11-26","2022-04-03 14:07:59","2022-04-03 14:07:59","2022-04-03 14:07:58","","","","","","","","","","","","","","en","","Tweet","","","","","","","","https://youtu.be/HI5wbYi4dHA","","","","","","","","","","","","","","","","","","","","","","","","","","","","","","","","","","","","","","","","","","","","","","","",""
"IWCF5962","forumPost","2021","Texas DPS [@TxDPS]","We are mindful that many members of law enforcement will be working over the holidays, some far away from their duty stations in support of #OperationLoneStar. These deployments are difficult on families, and we are grateful for the support they provide to their loved ones. https://t.co/ELhYunIkO6","Twitter","","","","https://twitter.com/TxDPS/status/1463651979704557572","","2021-11-24","2022-04-03 14:08:08","2022-04-03 14:08:08","2022-04-03 14:08:08","","","","","","","","","","","","","","en","","Tweet","","","","","","","","https://t.co/ELhYunIkO6","","","","","","","","","","","","","","","","","","","","","","","","","","","","","","","","","","","","","","","","","","","","","","","",""
"L68Q4KPT","forumPost","2021","Texas DPS [@TxDPS]","Last week, during a traffic stop in Edinburg, DPS Troopers encountered a smuggler who had two individuals hiding behind a radio speaker in the trunk of the vehicle. The two individuals were referred to Border Patrol, and the smuggler was arrested. #OperationLoneStar https://t.co/ifwrlaICkh","Twitter","","","","https://twitter.com/TxDPS/status/1463211263270526985","","2021-11-23","2022-04-03 14:08:21","2022-04-03 14:08:21","2022-04-03 14:08:21","","","","","","","","","","","","","","en","","Tweet","","","","","","","","https://t.co/ifwrlaICkh","","","","","","","","","","","","","","","","","","","","","","","","","","","","","","","","","","","","","","","","","","","","","","","",""
"HU76PQ75","forumPost","2021","Texas DPS [@TxDPS]","Our mission under Gov. @GregAbbott_TX's #OperationLoneStar is to secure the border & protect TX communities. DPS continues to enforce all state violations of law incl., but not limited to, criminal trespass, criminal mischief, smuggling & human trafficking. https://t.co/qNH4JJRmTy","Twitter","","","","https://twitter.com/TxDPS/status/1462882884814049286","","2021-11-22","2022-04-03 14:08:34","2022-04-03 14:08:34","2022-04-03 14:08:34","","","","","","","","","","","","","","en","","Tweet","","","","","","","","https://t.co/qNH4JJRmTy","","","","","","","","","","","","","","","","","","","","","","","","","","","","","","","","","","","","","","","","","","","","","","","",""
"P7XYP8LV","forumPost","2021","Texas DPS [@TxDPS]","Our Tactical Marine Unit took @BillFOXLA for a ride today where he reported live from the Rio Grande on how Texas and Gov. @GregAbbott_TX are fighting back against drug and human traffickers as part of #OperationLoneStar 👀👇🏽https://t.co/mH1ptzgDW5","Twitter","","","","https://twitter.com/TxDPS/status/1461756037002932227","","2021-11-19","2022-04-03 14:08:47","2022-04-03 14:08:47","2022-04-03 14:08:47","","","","","","","","","","","","","","en","","Tweet","","","","","","","","https://t.co/mH1ptzgDW5","","","","","","","","","","","","","","","","","","","","","","","","","","","","","","","","","","","","","","","","","","","","","","","",""
"ALNF32Z8","forumPost","2021","Texas DPS [@TxDPS]","DPS seized more than 130kg of methamphetamine during an operation that began when law enforcement learned a drug trafficker in Mexico was looking for a buyer in Houston. Not on our watch. Thank you @GovAbbott and the entire #txlege for #OperationLoneStar resources to fight back. https://t.co/Or1yTl7YU3","Twitter","","","","https://twitter.com/TxDPS/status/1461531418639716358","","2021-11-19","2022-04-03 14:08:58","2022-04-03 14:08:58","2022-04-03 14:08:58","","","","","","","","","","","","","","en","","Tweet","","","","","","","","https://t.co/Or1yTl7YU3","","","","","","","","","","","","","","","","","","","","","","","","","","","","","","","","","","","","","","","","","","","","","","","",""
"34PQZJZ9","forumPost","2021","Texas DPS [@TxDPS]","WATCH LIVE: #OperationLoneStar Weekly Briefing, featuring @TxDPS, @TXMilitary & @TDCJ at https://facebook.com/2118412605136040/videos/193613156271295.","Twitter","","","","https://twitter.com/TxDPS/status/1461365931024781312","","2021-11-18","2022-04-03 14:09:11","2022-04-03 14:09:11","2022-04-03 14:09:11","","","","","","","","","","","","","","en","","Tweet","","","","","","","","https://facebook.com/2118412605136040/videos/193613156271295","","","","","","","","","","","","","","","","","","","","","","","","","","","","","","","","","","","","","","","","","","","","","","","",""
"6I5X6N8P","forumPost","2021","Texas DPS [@TxDPS]","“@LtChrisOlivarez said troopers have arrested migrants who have criminal records, and criminal gang members including MS-13 and cartel members. He said some of the migrants have become aggressive when approached by officers.” #OperationLoneStar","Twitter","","","","https://twitter.com/TxDPS/status/1461020638483730436","","2021-11-17","2022-04-03 14:09:24","2022-04-03 14:09:24","2022-04-03 14:09:24","","","","","","","","","","","","","","en","","Tweet","","","","","","","","","","","","","","","","","","","","","","","","","","","","","","","","","","","","","","","","","","","","","","","","","","","","","","","",""
"WCLXN7ZH","forumPost","2021","Texas DPS [@TxDPS]",".@LtChrisOlivarez raises concern over 'criminal gang members' crossing the border and discusses #OperationLoneStar https://t.co/PAokJlvclc","Twitter","","","","https://twitter.com/TxDPS/status/1460343885327224839","","2021-11-15","2022-04-03 14:09:34","2022-04-03 14:09:34","2022-04-03 14:09:34","","","","","","","","","","","","","","en","","Tweet","","","","","","","","https://t.co/PAokJlvclc","","","","","","","","","","","","","","","","","","","","","","","","","","","","","","","","","","","","","","","","","","","","","","","",""
"MF3VSEYT","forumPost","2021","Texas DPS [@TxDPS]","Texas DPS Aviation flying border interdiction patrols in support of Gov. @GregAbbott_TX’s #OperationLoneStar located smugglers carrying large bundles of narcotics in Big Bend this weekend. https://t.co/bs9mMWTSOj","Twitter","","","","https://twitter.com/TxDPS/status/1460309235330334724","","2021-11-15","2022-04-03 14:09:44","2022-04-03 14:09:44","2022-04-03 14:09:44","","","","","","","","","","","","","","en","","Tweet","","","","","","","","https://t.co/bs9mMWTSOj","","","","","","","","","","","","","","","","","","","","","","","","","","","","","","","","","","","","","","","","","","","","","","","",""
"HZMCNH37","forumPost","2021","Texas DPS [@TxDPS]","Texas DPS Arrests Cartel Smuggler, Convicted Felon as part of Gov. @GregAbbott_TX’s #OperationLoneStar https://t.co/ynPoqkjmPP","Twitter","","","","https://twitter.com/TxDPS/status/1459253004591411209","","2021-11-12","2022-04-03 14:09:57","2022-04-03 14:09:57","2022-04-03 14:09:57","","","","","","","","","","","","","","en","","Tweet","","","","","","","","https://t.co/ynPoqkjmPP","","","","","","","","","","","","","","","","","","","","","","","","","","","","","","","","","","","","","","","","","","","","","","","",""
